Question,Answer
"1. What are the regulations regarding the use of pasturage according to the Maharashtra Land Revenue Code, 1966?","According to the Maharashtra Land Revenue Code, 1966, the regulations regarding the use of pasturage are outlined in Section 23 of the code."
2. How does the Code address the recovering value of natural products that have been unauthorizedly removed from certain lands?,"The Code addresses the recovering value of natural products unauthorizedly removed from certain lands in Section 24. This section likely outlines the procedures and mechanisms for recovering the value of natural products that have been unlawfully taken from specific lands. It may include provisions for penalties, compensation, or other measures to address such unauthorized removal of natural resources."
3. What rights do individuals have to trees in their holdings as outlined in the Code?,"According to the Maharashtra Land Revenue Code, individuals have rights to trees in their holdings. The specific details of these rights are outlined in Section 25 of the Code."
"4. How are trees and forests vested in the Government according to the Maharashtra Land Revenue Code, 1966?","According to the Maharashtra Land Revenue Code, 1966, trees and forests are vested in the Government."
"5. What is the procedure for the regulation of cutting and supply of wood, etc., as stated in the Code?","The procedure for the regulation of cutting and supply of wood, etc., as stated in the Maharashtra Land Revenue Code, 1966, is outlined in Section 28 of the Code. This section likely provides details on how the cutting and supply of wood, etc., is to be regulated, including any permits or permissions required, restrictions on cutting, penalties for unauthorized cutting, and other related matters."
6. What are the classes of persons holding land according to the Code?,"The classes of persons holding land according to the Maharashtra Land Revenue Code, 1966 are not explicitly mentioned in the provided sections of the Code. For specific details on the classes of persons holding land, you may need to refer to other sections or parts of the Maharashtra Land Revenue Code, 1966."
7. How does the Code address the occupation of unalienated land granted under its provisions?,"The Maharashtra Land Revenue Code, 1966 addresses the occupation of unalienated land granted under its provisions in Section 30. This section likely outlines the rules and regulations regarding the occupation of unalienated land that is granted under the provisions of the Code. It may specify the conditions, rights, and responsibilities of individuals who occupy such land."
"8. What conditions must be met for unoccupied land to be granted according to the Maharashtra Land Revenue Code, 1966?","Unoccupied land may be granted under the provisions of the Maharashtra Land Revenue Code, 1966, on certain conditions. Unfortunately, the specific conditions that must be met for unoccupied land to be granted are not detailed in the provided sections of the Code. For the exact conditions, it would be necessary to refer to the specific provisions within the Maharashtra Land Revenue Code, 1966."
9. What is the temporary right to alluvial lands of small extent as outlined in the Code?,"The temporary right to alluvial lands of small extent as outlined in the Code refers to the provision that allows individuals to have a temporary right to use and occupy small areas of alluvial lands for specific purposes. This right is subject to certain conditions and limitations set forth in the Maharashtra Land Revenue Code, 1966."
10. What penalties are in place for using land without permission for non-agricultural purposes according to the Code?,"According to the Maharashtra Land Revenue Code, 1966, penalties for using land without permission for non-agricultural purposes are outlined in Section 45. However, the specific details of the penalties are not provided in the context provided."
