Question,Answer
1. What is the Maharashtra Land Revenue Code of 1966 primarily concerned with?,"The Maharashtra Land Revenue Code of 1966 is primarily concerned with the division of the State into revenue areas and the constitution of those revenue areas, including districts, sub-divisions, talukas, circles, sazas, and villages."
2. How is the State divided for the purpose of the Maharashtra Land Revenue Code?,"The State of Maharashtra is divided into divisions, which consist of one or more districts (including the City of Bombay). Each district may consist of one or more sub-divisions, each sub-division may consist of one or more talukas, and each taluka may consist of certain villages."
3. What authority does the State Government have in terms of specifying revenue areas?,"The State Government has the authority to specify districts, sub-divisions, talukas, villages, and local areas that constitute revenue areas. They can also alter the limits of these areas through amalgamation, division, or in any other manner, as well as abolish any revenue area. Additionally, the State Government can name or alter the name of any revenue area."
4. How can the State Government alter the limits of revenue areas according to the Code?,"The State Government can alter the limits of revenue areas according to the Maharashtra Land Revenue Code, 1966, by issuing a notification in the Official Gazette. This notification can specify the districts, sub-divisions, talukas, villages, and local areas that constitute the revenue areas. The alteration can be done through amalgamation, division, or in any other manner specified in the notification. Additionally, the State Government can rename any revenue area, and references to the area under its original name will be deemed to refer to the area under the new name, unless expressly provided otherwise."
5. What is the significance of constituting wadis and villages outside the limits of gaothans under the Code?,"The significance of constituting wadis and villages outside the limits of gaothans under the Maharashtra Land Revenue Code is to officially recognize these areas as separate villages with their own distinct identities and administrative boundaries. This recognition allows for the proper governance, administration, and allocation of resources to these areas, ensuring that they receive the necessary attention and services from the government."
6. What role does the Collector play in arranging villages within a taluka according to the Code?,"The Collector, according to the Maharashtra Land Revenue Code of 1966, plays a role in arranging villages within a taluka to constitute a ""saza."" Additionally, the Collector can arrange the sazas in a taluka to constitute a ""circle."" The Collector also has the authority to alter the limits of, or abolish any saza or circle that has been constituted."
"7. How are existing divisions, districts, sub-divisions, talukas, circles, sazas, and villages affected by the implementation of the Code?","Existing divisions, districts, sub-divisions, talukas, circles, sazas, and villages at the commencement of the Maharashtra Land Revenue Code, 1966, continue under the names they bear unless altered under the provisions of the Code. The State Government has the authority to specify and alter the limits of these revenue areas by amalgamation, division, or in any other manner. Any renaming of areas will result in all references in laws or documents being deemed to refer to the area under its new name, unless expressly stated otherwise."
8. What conditions must be met for notifications or orders regarding revenue areas to be valid under the Code?,"Every notification or order made regarding revenue areas under the Maharashtra Land Revenue Code, 1966, must be subject to the condition of previous publication. Additionally, the provisions of section 24 of the Bombay General Clauses Act, 1904, shall apply in relation to such notifications or orders, as they apply in relation to rules to be made after previous publication."
"9. What amendments were made to the Maharashtra Land Revenue Code in 1981 and 1969, respectively?","In 1981, the Maharashtra Land Revenue Code was amended to include the City of Bombay within the districts. In 1969, an amendment was made to change the population requirement for an area outside the limits of the gaothan of a village to be considered a village from ""three hundred"" to a number that was substituted."
10. How does the Maharashtra Land Revenue Code ensure transparency and public input in the establishment and alteration of revenue areas?,"The Maharashtra Land Revenue Code ensures transparency and public input in the establishment and alteration of revenue areas by requiring the State Government to publish notifications in the Official Gazette specifying the districts, sub-divisions, talukas, villages, and local areas that constitute revenue areas. These notifications are subject to previous publication, allowing for public awareness and input. Additionally, any alterations to the revenue areas must be made through orders published in the prescribed manner, providing an opportunity for public scrutiny and feedback."
"1. Who is the Chief controlling authority in all matters connected with land revenue in a division according to the Maharashtra Land Revenue Code, 1966?","According to the Maharashtra Land Revenue Code, 1966, the Chief controlling authority in all matters connected with land revenue in a division is the Commissioner, subject to the superintendence, direction, and control of the State Government."
2. What are the powers and duties of the Commissioner in a division as outlined in the Code?,"The powers and duties of the Commissioner in a division as outlined in the Maharashtra Land Revenue Code include being the chief controlling authority in all matters connected with land revenue in the division. The Commissioner operates subject to the superintendence, direction, and control of the State Government."
3. How are revenue officers appointed in a division according to the Code?,"In a division, revenue officers are appointed by the State Government. The State Government appoints a Commissioner for each division and may also appoint an Additional Commissioner and Assistant Commissioners as needed to assist the Commissioner. Additionally, the State Government appoints a Collector for each district within the division and a Tahsildar for each taluka."
4. What is the role of a Collector in a district as per the Code?,"As per the Maharashtra Land Revenue Code, the role of a Collector in a district is to be in charge of the revenue administration of that district. The Collector is responsible for overseeing the revenue administration and may appoint additional officers like Assistant Collectors, Deputy Collectors, Naib-Tahsildars, and other personnel to assist in the revenue-related matters within the district."
5. What additional officers can the State Government appoint in a district according to the Code?,"The State Government can appoint Additional Collectors, Assistant Collectors, Deputy Collectors, Naib-Tahsildars, Additional Tahsildars, Naib-Tahsildars, Circle Officers, Circle Inspectors, Talathis, Kotwals, and other village servants in a district according to the Maharashtra Land Revenue Code."
6. What are the designations of officers that the State Government may appoint for specific chapters outlined in the Code?,"For specific chapters outlined in the Maharashtra Land Revenue Code, the State Government may appoint officers with designations such as ""Settlement Commissioner"", ""Director of Land Records"", ""Deputy Director of Land Records"", ""Superintendents of Land Records"", ""Settlement Officers"", ""District Inspectors of Land Records"", and ""Survey Tahsildars"", or any other designations deemed requisite."
7. Is it lawful for the State Government to appoint one person to multiple offices or confer powers and duties of one officer to another within certain limits according to the Code?,"Yes, it is lawful for the State Government to appoint one and the same person to any two or more of the offices provided for in Chapter II of the Maharashtra Land Revenue Code, 1966. Additionally, the State Government can confer upon an officer of one denomination all or any of the powers or duties of any other officer within certain local limits or otherwise, as deemed expedient."
8. How can the State Government make appointments under section 7 of the Code?,"The State Government can make appointments under section 7 of the Maharashtra Land Revenue Code by appointing officers such as ""Settlement Commissioner"", ""Director of Land Records"", ""Deputy Director of Land Records"", ""Superintendents of Land Records"", ""Settlement Officers"", ""District Inspectors of Land Records"", and ""Survey Tahsildars"", or by designating other necessary officers as deemed requisite."
9. What specific provision was added to the Code by Mah. 30 of 1968 regarding the State Government's powers to make appointments?,The specific provision added to the Maharashtra Land Revenue Code by Mah. 30 of 1968 regarding the State Government's powers to make appointments is Section 9A.
"1. According to the Maharashtra Land Revenue Code, 1966, who may temporarily succeed a Collector or Tahsildar if they are unable to perform their duties?","If a Collector or Tahsildar is disabled from performing his duties or vacates their office, the temporary successor would be the Additional Collector, or if there is no Additional Collector, the Assistant or Deputy Collector of the highest rank in the district. If the Tahsildar is unable to perform their duties, the temporary successor would be the Additional Tahsildar, or if there is no Additional Tahsildar, the Naib-Tahsildar or the senior-most subordinate Revenue Officer in the taluka."
"2. How are revenue officers in a division and district subordinate to the State Government, Commissioner, and Collector, respectively?","Revenue officers in a division are subordinate to the Commissioner, and revenue officers in a district are subordinate to the Collector. This hierarchy is established unless the State Government directs otherwise. All revenue officers are ultimately subordinate to the State Government."
"3. When does the appointment of officers of and above the rank of Tahsildar take effect according to the Maharashtra Land Revenue Code, 1966?","The appointment of officers of and above the rank of Tahsildar, according to the Maharashtra Land Revenue Code, 1966, takes effect from the date on which an officer assumes charge of his office."
"4. What powers and duties are conferred upon revenue officers of and above the rank of a Tahsildar under the Maharashtra Land Revenue Code, 1966?","Revenue officers of and above the rank of a Tahsildar under the Maharashtra Land Revenue Code, 1966, are conferred with the powers and duties to exercise the functions imposed on them under the Code or any other prevailing law. They also have the authority to oversee the Officers subordinate to them within their respective jurisdiction. Additionally, they may have powers of appeal, superintendence, and control as prescribed by the State Government. The Collector, specifically, can exercise all the powers and duties of an Assistant or Deputy Collector throughout his district."
"5. How are temporary vacancies in the office of a Collector or Tahsildar addressed according to the Maharashtra Land Revenue Code, 1966?","According to the Maharashtra Land Revenue Code, 1966, if a Collector or Tahsildar is disabled from performing their duties, vacates their office, leaves their jurisdiction, or dies, the Additional Collector or the Assistant/Deputy Collector of the highest rank in the district would succeed temporarily to the office of the Collector or Tahsildar. This temporary successor would hold the position until the original Collector or Tahsildar resumes charge or until a successor is duly appointed and takes charge of the appointment."
"1. What powers and duties are assigned to revenue officers under the Maharashtra Land Revenue Code, 1966?","The powers and duties assigned to revenue officers under the Maharashtra Land Revenue Code, 1966 include exercising powers delegated by Collectors, carrying out duties and functions as directed by the State Government, and performing tasks related to the survey, settlement, and record of rights. They also have the authority to assign duties to their subordinates and act according to the instructions of the State Government."
2. How can a Tahsildar exercise powers delegated by the Collectors under the general or special orders of the State Government?,"A Tahsildar can exercise powers delegated by the Collectors under the general or special orders of the State Government by following the provisions outlined in the Maharashtra Land Revenue Code, 1966. The Tahsildar must adhere to the control, general or special orders of the State Government, and carry out the duties and functions assigned to them for the purpose of implementing the provisions of any law in force."
"3. What powers and duties can the Additional Commissioner, Assistant Commissioner, Additional Collector, and Additional Tahsildar exercise within their jurisdiction as per the provisions of the Code?","The Additional Commissioner, Assistant Commissioner, Additional Collector, and Additional Tahsildar can exercise such powers and discharge such duties and functions within their jurisdiction as the State Government may confer or impose on them by an order in writing for the purpose of carrying out the provisions of any law in force. They can also exercise powers and duties of higher-ranking officials like the Commissioner, Collector, or Tahsildar as directed by the State Government through notification in the Official Gazette."
"4. How can a Sub-Divisional Officer perform duties and exercise powers conferred upon a Collector under the Maharashtra Land Revenue Code, 1966?","A Sub-Divisional Officer can perform all the duties and functions and exercise all the powers conferred upon a Collector by the Maharashtra Land Revenue Code, 1966, in relation to the sub-division in their charge. However, the Collector may direct the Sub-Divisional Officer not to perform certain duties or exercise certain powers and reserve them for themselves or assign them to any Assistant or Deputy Collector subordinate to the Collector."
5. Under what circumstances can a Collector direct a Sub-Divisional Officer not to perform certain duties or exercise certain powers?,A Collector can direct a Sub-Divisional Officer not to perform certain duties or exercise certain powers when the Collector deems it fit to do so. This decision can be made based on the specific circumstances or requirements of the situation.
"6. How can a Collector assign duties, functions, and powers of a Tahsildar to a Naib-Tahsildar within his local limits?","A Collector can assign duties, functions, and powers of a Tahsildar to a Naib-Tahsildar within his local limits subject to the orders of the State Government and the Commissioner. This assignment can be made based on what the Collector deems fit at that particular time."
"7. What instructions do Revenue Officers need to follow in matters not specifically provided for by law according to the Maharashtra Land Revenue Code, 1966?","In matters not specifically provided for by law, Revenue Officers need to follow the instructions of the State Government according to the Maharashtra Land Revenue Code, 1966."
"8. What powers and duties are vested with survey officers in relation to the survey, settlement, and record of rights as per the Code?","Survey officers are vested with the cognizance of all matters connected with the survey, settlement, and record of rights. They are responsible for exercising all powers and performing all duties as provided by the Maharashtra Land Revenue Code, 1966 or any other law in force related to these matters."
1. What powers and duties are exercised by a Deputy Director of Land Records as mentioned in the text?,"A Deputy Director of Land Records shall exercise powers and discharge duties and functions that are exercised or discharged by the Director of Land Records under the Maharashtra Land Revenue Code, 1966, or under any law in force, as directed by the State Government or Director of Land Records."
"2. What responsibilities does a Talathi have according to the Maharashtra Land Revenue Code, 1966?","According to the Maharashtra Land Revenue Code, 1966, a Talathi is responsible for the collection of land revenue and all amounts recoverable as arrears of land revenue, as well as for the maintenance of the record of rights. Additionally, a Talathi is required to perform all duties and functions as provided by the Code, any other law in force, or by the order of the State Government."
"3. Who determines what registers, accounts, and other records should be kept by a Talathi?","Subject to the general orders of the State Government and the Commissioner, the Collector determines from time to time what registers, accounts, and other records shall be kept by a Talathi."
4. What duties are assigned to revenue officers as per the State Government's directions?,"As per the State Government's directions, revenue officers are assigned the duty of determining what registers, accounts, and other records should be kept by a Talathi."
5. How can the State Government confer powers on a person to act as an Assistant or Deputy Collector or Tahsildar?,The State Government can confer powers on a person to act as an Assistant or Deputy Collector or Tahsildar by providing that person with the prescribed qualifications as per the notification in the Official Gazette.
"6. What provisions are made for the recovery of money, papers, or other government property in the text?","Provisions for the recovery of money, papers, or other government property are outlined in Section 17 of the Maharashtra Land Revenue Code, 1966. According to this section, the Collector, Superintendent of Land Records, or any other officer designated by them can demand the delivery of public money, papers, or other property of the State Government from revenue officers or individuals who were previously employed in their department. This demand must be made in writing under the officer's signature and official seal, if used. If the money, papers, or property are not delivered as directed, further actions can be taken as specified in the section."
"7. How does a revenue officer or other designated officer request the delivery of money, papers, or property from a person as per the Maharashtra Land Revenue Code, 1966?","A revenue officer or other designated officer can request the delivery of money, papers, or property from a person by issuing a written notice under their signature and official seal, if they use one. This written notice will specify the amount of money, the particular papers, or the property that needs to be delivered, and it will also mention the date, time, and place for the delivery. If the person does not comply with the request, the Collector, Superintendent, or the designated officer can take further action as per the provisions of the Maharashtra Land Revenue Code, 1966."
"8. What is the process for demanding money, papers, or property to be delivered as specified in the text?","The process for demanding money, papers, or property to be delivered as specified in the text involves the Collector, Superintendent of Land Records, or any other officer deputed by them to issue a written notice under their signature and official seal (if used) to the person who owes the money or is in possession of the papers or property. This notice will specify the amount of money, the particular papers or property, the date, and the place for delivery. If the person does not comply with the demand, further action can be taken as per the provisions of the Maharashtra Land Revenue Code, 1966."
