Question,Answer
"1. What provisions of the Maharashtra Land Revenue Code, 1966 apply to holders of alienated land?","The provisions of sections 35 and 55 of the Maharashtra Land Revenue Code, 1966 apply to holders of alienated land."
2. What happens to the right of way through land retained by a person who relinquishes land?,The right of way through the land retained by a person who relinquishes land shall continue to the future holder of the land that has been relinquished.
3. How does section 55 of the Code affect the validity of leases or other express instruments for land held from the State Government?,"Section 55 of the Maharashtra Land Revenue Code, 1966 does not affect the validity of the terms or conditions of any lease or other express instrument under which land is, or may be held from the State Government."
4. Who has the authority to summarily evict a person who is unauthorisedly occupying or wrongfully in possession of land?,"The authority to summarily evict a person who is unauthorisedly occupying or wrongfully in possession of land lies with the Collector, as per the Maharashtra Land Revenue Code, 1966."
5. Under what circumstances can the State Government suspend the operation of section 55 within a prescribed local area?,"The State Government can suspend the operation of section 55 within a prescribed local area under the circumstances of either generally, or in respect of cultivators or occupants of a particular class or classes."
6. How does the Code protect certain occupancies from the process of courts in cases where transfer has not been sanctioned by the Collector?,"In cases where an occupancy is not transferable without the previous sanction of the Collector and such sanction has not been granted to a transfer made or ordered by a civil court, the Maharashtra Land Revenue Code protects the occupancy in the following ways:

a) The occupancy shall not be liable to the process of any court.
b) The transfer shall be considered null and void.
c) Upon receipt of a certificate from the Collector stating that the occupancy is not transferable without his previous sanction and that such sanction has not been granted, the court shall remove any attachment or other process placed on the occupancy or set aside any sale affecting the occupancy."
7. What action can a civil court take upon receipt of a certificate from the Collector regarding the transferability of an occupancy?,"Upon receipt of a certificate from the Collector stating that an occupancy is not transferable without the Collector's previous sanction and that such sanction has not been granted, a civil court can take the following actions:

(a) The occupancy shall not be liable to the process of any court.
(b) Any transfer of the occupancy shall be considered null and void.
(c) The court shall remove any attachment or other process placed on the occupancy or set aside any sale affecting the occupancy."
