Question,Answer
"1. What is the power of the State Government in exempting land from assessment for water advantages according to the Maharashtra Land Revenue Code, 1966?","According to the Maharashtra Land Revenue Code, 1966, the State Government has the power to exempt any land from assessment under this Chapter for any advantage or specified kind of advantage accruing to it from water. The orders passed by the State Government in this regard are final and cannot be questioned in any court."
"2. How can the State Government withdraw an exemption granted for a land under the Maharashtra Land Revenue Code, 1966?","The State Government can withdraw an exemption granted for a land under the Maharashtra Land Revenue Code, 1966 by publishing a notice in Marathi in the village concerned and after the expiry of a period of six months from the date of the publication of such notice. After this process, the State Government can direct that the land shall be assessed for the advantage for which the exemption was granted."
"3. When does the settlement introduced by the State Government under section 100 of the Maharashtra Land Revenue Code, 1966 come into effect?","After the State Government has passed orders under section 100 and notice of the same has been given in the prescribed manner, the settlement shall be deemed to have been introduced. The land revenue according to such settlement shall be levied from the date as directed by the State Government."
"4. What provisions are made for remission of increased rates in the year following the introduction of a new settlement under the Maharashtra Land Revenue Code, 1966?","In the year following the introduction of a new settlement under the Maharashtra Land Revenue Code, 1966, any occupant who may be dissatisfied with the increased rate imposed by the new assessment on any of the survey numbers or sub-divisions of survey numbers held by him shall receive a remission of the increase if they relinquish such number or sub-division in the manner provided by section 55."
"5. What is the process for a person claiming to hold land free of land revenue to prove their title according to the Maharashtra Land Revenue Code, 1966?","According to the Maharashtra Land Revenue Code, 1966, a person claiming to hold land free of land revenue must prove their title to the satisfaction of the Settlement Officer. If they are able to prove their title, the case will be reported for the orders of the State Government."
"6. How can a Settlement Officer determine and register the proper full assessment on lands wholly exempt from the payment of land revenue under the Maharashtra Land Revenue Code, 1966?","A Settlement Officer can determine and register the proper full assessment on lands wholly exempt from the payment of land revenue under the Maharashtra Land Revenue Code, 1966, by following the provisions of Section 104 of the code. This section allows the Settlement Officer to determine and register the proper full assessment on such lands. The assessment determined and registered will be leviable once the exemption is withdrawn, and it will be considered as fixed under the provisions of the code."
"7. In what circumstances can the State Government direct that additional land revenue be assessed on land during the term of a settlement under the Maharashtra Land Revenue Code, 1966?","The State Government can direct that additional land revenue be assessed on land during the term of a settlement under the Maharashtra Land Revenue Code, 1966 when there are additional advantages accruing to the land from water received on account of irrigation works or improvements on existing irrigation works completed after the State Government has directed the settlement under section 92 and not effected by or."
